id,title,release_date,popularity,overview
502356,The Super Mario Bros. Movie,2023-04-05,172.955,"While working underground to fix a water main, Brooklyn plumbers—and brothers—Mario and Luigi are transported down a mysterious pipe and wander into a magical new world. But when the brothers are separated, Mario embarks on an epic quest to find Luigi."
979296,Sonic Drone Home,2022-05-24,172.555,"Sonic, Tails, and Knuckles encounter an abandoned Badnik drone which upgraded itself using parts from a junkyard, with the intention of conquering the world."
251837,Homo Eroticus,1971-09-14,133.45,"Michele is a three-testicle, sexually insatiable man who goes around bedding all women in town (regardless of age), until one day things goes terribly wrong."
1231813,Sister Swapping,2023-12-19,171.871,"Sisters Ji-soo and Ji-yeong decided to sell their used underwear due to financial difficulties. Perverted men offer to buy them at a higher price by asking these two sisters for shots of them wearing the underwear. Other men offer to pay even higher prices by demanding sex out of greater desire. As the sisters earn more money than expected, their service becomes more and more popular."
974262,Descendants: The Rise of Red,2024-07-11,171.834,"After the Queen of Hearts incites a coup on Auradon, her rebellious daughter Red and Cinderella's perfectionist daughter Chloe join forces and travel back in time to try to undo the traumatic event that set Red's mother down her villainous path."
120,The Lord of the Rings: The Fellowship of the Ring,2001-12-18,180.637,"Young hobbit Frodo Baggins, after inheriting a mysterious ring from his uncle Bilbo, must leave his home in order to keep it from falling into the hands of its evil creator. Along the way, a fellowship is formed to protect the ringbearer and make sure that the ring arrives at its final destination: Mt. Doom, the only place where it can be destroyed."
588648,Dragonkeeper,2024-04-11,180.013,"Set in Han Imperial China, the plot follows the adventures of enslaved girl Ping with ancient dragon Long Danzi. Dragons had been banished from the kingdom. Ping, an orphan, finds one of the last remaining dragon eggs. Palace guards force Ping to run away in order to return the dragon egg to the ocean and save all dragons from extinction. Ping discovers that she is a true Dragonkeeper."
1208808,The Haunting of the Immaculate Nurse,2024-10-31,168.976,"A young nurse with a domestic abuse past starts working the night shift at a small hospital, where, during the night, the ghost of a nurse materializes."
1226578,Longlegs,2024-07-10,167.769,"FBI Agent Lee Harker is a gifted new recruit assigned to the unsolved case of an elusive serial killer. As the case takes complex turns, unearthing evidence of the occult, Harker discovers a personal connection to the merciless killer and must race against time to stop him before he claims the lives of another innocent family."
12444,Harry Potter and the Deathly Hallows: Part 1,2010-11-17,172.415,"Harry, Ron and Hermione walk away from their last year at Hogwarts to find and destroy the remaining Horcruxes, putting an end to Voldemort's bid for immortality. But with Harry's beloved Dumbledore dead and Voldemort's unscrupulous Death Eaters on the loose, the world is more dangerous than ever."
5255,The Polar Express,2004-11-10,133.056,"When a doubting young boy takes an extraordinary train ride to the North Pole, he embarks on a journey of self-discovery that shows him that the wonder of life never fades for those who believe."
299536,Avengers: Infinity War,2018-04-25,183.811,"As the Avengers and their allies have continued to protect the world from threats too large for any one hero to handle, a new danger has emerged from the cosmic shadows: Thanos. A despot of intergalactic infamy, his goal is to collect all six Infinity Stones, artifacts of unimaginable power, and use them to inflict his twisted will on all of reality. Everything the Avengers have fought for has led up to this moment - the fate of Earth and existence itself has never been more uncertain."
1296753,Remnant,2024-06-30,166.191,"Grace is a young woman whose life has been turned upside down by tragedy. When she returns home to the family farm to rebuild her shattered life, her world begins to unravel as a series of strange events haunt her, pushing Grace to the edge of madness. A mysterious figure lurks in the shadows and a ghostly woman appears in the darkness of night. Is Grace imagining these apparitions, or are they a warning of a nightmare still to come?"
637649,Wrath of Man,2021-04-22,165.107,"A cold and mysterious new security guard for a Los Angeles cash truck company surprises his co-workers when he unleashes precision skills during a heist. The crew is left wondering who he is and where he came from. Soon, the marksman's ultimate motive becomes clear as he takes dramatic and irrevocable steps to settle a score."
872585,Oppenheimer,2023-07-19,164.101,The story of J. Robert Oppenheimer's role in the development of the atomic bomb during World War II.
361743,Top Gun: Maverick,2022-05-21,163.21,"After more than thirty years of service as one of the Navy’s top aviators, and dodging the advancement in rank that would ground him, Pete “Maverick” Mitchell finds himself training a detachment of TOP GUN graduates for a specialized mission the likes of which no living pilot has ever seen."
616446,Brothers,2024-10-10,162.571,"A reformed criminal's attempt at going straight is derailed when he reunites with his sanity-testing twin brother on a road trip for the score of a lifetime. Dodging bullets, the law, and an overbearing mother along the way, they must heal their severed family bond before they end up killing each other."
1145491,Operation Black Ops,2023-07-11,162.209,"A group of mercenaries are hired to overthrow a Neo-Nazi stronghold nestled deep in the heart of Texas, only to discover they are protecting nuclear codes that could ignite World War III."
537915,After,2019-04-11,161.036,"Tessa Young is a dedicated student, dutiful daughter and loyal girlfriend to her high school sweetheart. Entering her first semester of college, Tessa's guarded world opens up when she meets Hardin Scott, a mysterious and brooding rebel who makes her question all she thought she knew about herself -- and what she wants out of life."
82023,Hotel Desire,2011-12-07,160.757,"Antonia is a single mother who works as a hotel maid in Berlin. A normal hot summer day takes a dramatic turn when she crosses paths with a particular guest of the hotel, famous blind portrait painter Julius Pass."
27066,The Voyeur,1994-01-27,159.852,"At a college in Rome, a professor, nicknamed ""Dodo"" is in a deep depression. His stunningly beautiful wife has just left him for another man. Dodo wants her back very badly and has erotic daydreams about her. A beautiful young student in his class asks him for a ride home and seduces the lucky man, but still he wonders about his wife and her lover."
51482,Death Note Relight 1: Visions of a God,2007-08-31,157.878,"Yagami Light is an ace student with great prospects, who's bored out of his mind. One day he finds the ""Death Note"": a notebook from the realm of the Death Gods, with the power to kill people in any way he desires. With the Death Note in hand, Light decides to create his perfect world, without crime or criminals. However, when criminals start dropping dead one by one, the authorities send the legendary detective L to track down the killer, and a battle of wits, deception and logic ensues... This was aired on Japanese TV  shortly after the death note anime was completed, this special basically re-cuts the first 26 episodes of the series into a two hour movie with some new scenes and dialogue added and the story is seen from Ryuk's viewpoint."
675,Harry Potter and the Order of the Phoenix,2007-07-08,154.776,"Returning for his fifth year of study at Hogwarts, Harry is stunned to find that his warnings about the return of Lord Voldemort have been ignored. Left with no choice, Harry takes matters into his own hands, training a small group of students to defend themselves against the dark arts."
1038263,Maria,2024-11-27,154.639,"Maria Callas, the world's greatest opera singer, lives the last days of her life in 1970s Paris, as she confronts her identity and life."
155,The Dark Knight,2008-07-16,153.88,"Batman raises the stakes in his war on crime. With the help of Lt. Jim Gordon and District Attorney Harvey Dent, Batman sets out to dismantle the remaining criminal organizations that plague the streets. The partnership proves to be effective, but they soon find themselves prey to a reign of chaos unleashed by a rising criminal mastermind known to the terrified citizens of Gotham as the Joker."
22,Pirates of the Caribbean: The Curse of the Black Pearl,2003-07-09,153.802,"After Port Royal is attacked and pillaged by a mysterious pirate crew, capturing the governor's daughter Elizabeth Swann in the process, William Turner asks free-willing pirate Jack Sparrow to help him locate the crew's ship—The Black Pearl—so that he can rescue the woman he loves."
346698,Barbie,2023-07-19,153.466,"Barbie and Ken are having the time of their lives in the colorful and seemingly perfect world of Barbie Land. However, when they get a chance to go to the real world, they soon discover the joys and perils of living among humans."
1290697,Kingmaker,2024-08-06,152.709,"Ulrik Torp, once a fearless investigative journalist who is now tackling unemployment and a midlife crisis. He finds himself in the middle of a new political conspiracy."
1139566,Through My Window 3: Looking at You,2024-02-23,151.379,"After the events of the summer, Ares and Raquel they don't see a way forward in their relationship and decide to go separate ways. But when they meet again in the winter in Barcelona, the love and desire they feel for each other is undeniable. Will they be able to find a way to get back together?"
1151949,The Shadow Strays,2024-09-10,150.823,"Skilled in the art of killing, a young assassin defies her mentor to save a boy from a ruthless crime syndicate — and she'll destroy anyone in her path."
122,The Lord of the Rings: The Return of the King,2003-12-17,150.608,"As armies mass for a final battle that will decide the fate of the world--and powerful, ancient forces of Light and Dark compete to determine the outcome--one member of the Fellowship of the Ring is revealed as the noble heir to the throne of the Kings of Men. Yet, the sole hope for triumph over evil lies with a brave hobbit, Frodo, who, accompanied by his loyal friend Sam and the hideous, wretched Gollum, ventures deep into the very dark heart of Mordor on his seemingly impossible quest to destroy the Ring of Power.​"
592831,Megalopolis,2024-09-25,150.282,"Genius artist Cesar Catilina seeks to leap the City of New Rome into a utopian, idealistic future, while his opposition, Mayor Franklyn Cicero, remains committed to a regressive status quo, perpetuating greed, special interests, and partisan warfare. Torn between them is socialite Julia Cicero, the mayor’s daughter, whose love for Cesar has divided her loyalties, forcing her to discover what she truly believes humanity deserves."
