id,title,release_date,popularity,overview
845781,Red One,2024-10-31,4760.061,"After Santa Claus (codename: Red One) is kidnapped, the North Pole's Head of Security must team up with the world's most infamous tracker in a globe-trotting, action-packed mission to save Christmas."
939243,Sonic the Hedgehog 3,2024-12-19,4338.285,"Sonic, Knuckles, and Tails reunite against a powerful new adversary, Shadow, a mysterious villain with powers unlike anything they have faced before. With their abilities outmatched in every way, Team Sonic must seek out an unlikely alliance in hopes of stopping Shadow and protecting the planet."
558449,Gladiator II,2024-11-05,4194.404,"Years after witnessing the death of the revered hero Maximus at the hands of his uncle, Lucius is forced to enter the Colosseum after his home is conquered by the tyrannical Emperors who now lead Rome with an iron fist. With rage in his heart and the future of the Empire at stake, Lucius must look to his past to find strength and honor to return the glory of Rome to its people."
912649,Venom: The Last Dance,2024-10-22,3789.621,"Eddie and Venom are on the run. Hunted by both of their worlds and with the net closing in, the duo are forced into a devastating decision that will bring the curtains down on Venom and Eddie's last dance."
762509,Mufasa: The Lion King,2024-12-18,2888.542,"Told in flashbacks, Mufasa is an orphaned cub, lost and alone until he meets a sympathetic lion named Taka—the heir to a royal bloodline. The chance meeting sets in motion a journey of misfits searching for their destiny and working together to evade a threatening and deadly foe."
1241982,Moana 2,2024-11-21,2845.684,"After receiving an unexpected call from her wayfinding ancestors, Moana journeys alongside Maui and a new crew to the far seas of Oceania and into dangerous, long-lost waters for an adventure unlike anything she's ever faced."
1156593,Your Fault,2024-12-26,3958.479,The love between Noah and Nick seems unwavering despite their parents' attempts to separate them. But his job and her entry into college open up their lives to new relationships that will shake the foundations of both their relationship and the Leister family itself.
1005331,Carry-On,2024-12-05,2066.207,An airport security officer races to outsmart a mysterious traveler forcing him to let a dangerous item slip onto a Christmas Eve flight.
1043905,Dirty Angels,2024-12-11,1900.243,"During the United States' 2021 withdrawal from Afghanistan, a group of female soldiers posing as medical relief are sent back in to rescue a group of kidnapped teenagers caught between ISIS and the Taliban."
974453,Absolution,2024-10-31,1574.973,"An aging ex-boxer gangster working as muscle for a Boston crime boss receives an upsetting diagnosis.  Despite a faltering memory, he attempts to rectify the sins of his past and reconnect with his estranged children. He is determined to leave a positive legacy for his grandson, but the criminal underworld isn’t done with him and won’t loosen their grip willingly."
1010581,My Fault,2023-06-08,2292.349,"Noah must leave her city, boyfriend, and friends to move into William Leister's mansion, the flashy and wealthy husband of her mother Rafaela. As a proud and independent 17 year old, Noah resists living in a mansion surrounded by luxury. However, it is there where she meets Nick, her new stepbrother, and the clash of their strong personalities becomes evident from the very beginning."
1035048,Elevation,2024-11-07,1534.174,A single father and two women venture from the safety of their homes to face monstrous creatures to save the life of a young boy.
1000075,The Price of Money: A Largo Winch Adventure,2024-07-31,1046.832,"Largo Winch, devastated by the kidnapping of his son, realizes that if he finds those responsible for his bankruptcy, maybe he'll see his son again."
1184918,The Wild Robot,2024-09-08,977.514,"After a shipwreck, an intelligent robot called Roz is stranded on an uninhabited island. To survive the harsh environment, Roz bonds with the island's animals and cares for an orphaned baby goose."
539972,Kraven the Hunter,2024-12-11,825.215,"Kraven Kravinoff's complex relationship with his ruthless gangster father, Nikolai, starts him down a path of vengeance with brutal consequences, motivating him to become not only the greatest hunter in the world, but also one of its most feared."
533535,Deadpool & Wolverine,2024-07-24,819.043,"A listless Wade Wilson toils away in civilian life with his days as the morally flexible mercenary, Deadpool, behind him. But when his homeworld faces an existential threat, Wade must reluctantly suit-up again with an even more reluctant Wolverine."
933260,The Substance,2024-09-07,849.339,"A fading celebrity decides to use a black market drug, a cell-replicating substance that temporarily creates a younger, better version of herself."
1034541,Terrifier 3,2024-10-09,805.93,"Five years after surviving Art the Clown's Halloween massacre, Sienna and Jonathan are still struggling to rebuild their shattered lives. As the holiday season approaches, they try to embrace the Christmas spirit and leave the horrors of the past behind. But just when they think they're safe, Art returns, determined to turn their holiday cheer into a new nightmare. The festive season quickly unravels as Art unleashes his twisted brand of terror, proving that no holiday is safe."
1064213,Anora,2024-10-14,784.917,"A young sex worker from Brooklyn gets her chance at a Cinderella story when she meets and impulsively marries the son of an oligarch. Once the news reaches Russia, her fairytale is threatened as his parents set out to get the marriage annulled."
1182387,Armor,2024-10-30,782.644,"Armored truck security guard James Brody is working with his son Casey transporting millions of dollars between banks when a team of thieves led by Rook orchestrate a takeover of their truck to seize the riches. Following a violent car chase, Rook soon has the armored truck surrounded and James and Casey find themselves cornered onto a decrepit bridge."
957119,Sidelined: The QB and Me,2024-11-29,741.224,"Dallas, a burdened but headstrong dancer, is determined to get into the best dance school in the country—her late mother’s alma mater. However, that dream is suddenly derailed when the cheeky yet secretly grieving football star, Drayton, crashes into her life with a unique story of his own. Will the two of them be able to grow into their dreams together, or will their dreams be sidelined?"
519182,Despicable Me 4,2024-06-20,699.628,"Gru and Lucy and their girls—Margo, Edith and Agnes—welcome a new member to the Gru family, Gru Jr., who is intent on tormenting his dad. Gru also faces a new nemesis in Maxime Le Mal and his femme fatale girlfriend Valentina, forcing the family to go on the run."
1147416,"Miraculous World, London: At the Edge of Time",2024-11-14,693.853,"To save the future from a terrible fate, Marinette becomes Chronobug and teams up with Bunnyx to defeat a mysterious opponent who travels through time. Who is this new supervillain, and why are they obsessed with exposing Marinette's secret superhero identity? Marinette's only hope is to defeat her new opponent to prevent the end of Ladybug and time itself!"
402431,Wicked,2024-11-20,672.43,"In the land of Oz, ostracized and misunderstood green-skinned Elphaba is forced to share a room with the popular aristocrat Glinda at Shiz University, and the two's unlikely friendship is tested as they begin to fulfill their respective destinies as Glinda the Good and the Wicked Witch of the West."
1022789,Inside Out 2,2024-06-11,667.5,"Teenager Riley's mind headquarters is undergoing a sudden demolition to make room for something entirely unexpected: new Emotions! Joy, Sadness, Anger, Fear and Disgust, who’ve long been running a successful operation by all accounts, aren’t sure how to feel when Anxiety shows up. And it looks like she’s not alone."
1138194,Heretic,2024-10-31,665.958,"Two young missionaries are forced to prove their faith when they knock on the wrong door and are greeted by a diabolical Mr. Reed, becoming ensnared in his deadly game of cat-and-mouse."
1299652,Watchmen: Chapter II,2024-11-25,664.253,"Suspicious of the events ensnaring their former colleagues, Nite Owl and Silk Spectre are spurred out of retirement to investigate. As they grapple with personal ethics, inner demons and a society turned against them, they race the clock to uncover a deepening plot that might trigger global nuclear war."
1118031,Apocalypse Z: The Beginning of the End,2024-10-04,662.422,"When a kind of rabies that transforms people into aggressive creatures spreads across the planet, Manel isolates himself at home with his cat, relying on his wits to survive; but soon they must go out in search of food, by land and by sea, dodging many dangers."
426063,Nosferatu,2024-12-25,652.19,"A gothic tale of obsession between a haunted young woman and the terrifying vampire infatuated with her, causing untold horror in its wake."
8871,How the Grinch Stole Christmas,2000-11-17,642.878,The Grinch decides to rob Whoville of Christmas - but a dash of kindness from little Cindy Lou Who and her family may be enough to melt his heart...
945961,Alien: Romulus,2024-08-13,636.39,"While scavenging the deep ends of a derelict space station, a group of young space colonizers come face to face with the most terrifying life form in the universe."
645757,That Christmas,2024-11-27,635.944,It's an unforgettable Christmas for the townsfolk of Wellington-on-Sea when the worst snowstorm in history alters everyone's plans — including Santa's.
1100782,Smile 2,2024-10-16,624.238,"About to embark on a new world tour, global pop sensation Skye Riley begins experiencing increasingly terrifying and inexplicable events. Overwhelmed by the escalating horrors and the pressures of fame, Skye is forced to face her dark past to regain control of her life before it spirals out of control."
1167271,Weekend in Taipei,2024-09-19,617.535,"A former DEA agent and a former undercover operative revisit their romance during a fateful weekend in Taipei, unaware of the dangerous consequences of their past."
772,Home Alone 2: Lost in New York,1992-11-15,591.243,"Instead of flying to Florida with his folks, Kevin ends up alone in New York, where he gets a hotel room with his dad's credit card—despite problems from a clerk and meddling bellboy. But when Kevin runs into his old nemeses, the Wet Bandits, he's determined to foil their plans to rob a toy store on Christmas Eve."
675353,Sonic the Hedgehog 2,2022-03-30,583.723,"After settling in Green Hills, Sonic is eager to prove he has what it takes to be a true hero. His test comes when Dr. Robotnik returns, this time with a new partner, Knuckles, in search for an emerald that has the power to destroy civilizations. Sonic teams up with his own sidekick, Tails, and together they embark on a globe-trotting journey to find the emerald before it falls into the wrong hands."
698687,Transformers One,2024-09-11,574.703,"The untold origin story of Optimus Prime and Megatron, better known as sworn enemies, but once were friends bonded like brothers who changed the fate of Cybertron forever."
1188808,Tuhog,2023-11-03,567.19,"Abie mourns after the death of Michael. She finds solace from her supposedly soon-to-be father-in-law, Roldan, and starts falling for him. But when Michael returns, their world turns upside down."
1276945,Ferry 2,2024-12-19,557.298,"After losing his drug empire, Ferry Bouman has found a measure of peace away from Brabant's criminal underworld — until his past catches up to him."
1051896,Arcadian,2024-04-12,534.926,"In the near future, on a decimated Earth, Paul and his twin sons face terror at night when ferocious creatures awaken. When Paul is nearly killed, the boys come up with a plan for survival, using everything their father taught them to keep him alive."
1252309,Pídeme lo que quieras,2024-11-29,493.382,"After his father's death, Eric Zimmerman travels to Spain to oversee his company's branches. In Madrid, he falls for Judith and engage in an intense, erotic relationship full of exploration. However, Eric fears his secret may end their affair."
1196470,Survive,2024-06-19,479.0,A couple celebrates their son’s birthday in the middle of the ocean on their boat. A violent storm hits and it brings up hungry creatures from the depths and they fight for their survival.
1389147,SDI: Secret Department of Intervention,2024-11-28,476.703,"Secret agents Mike, Stan, and Chloé, tasked with retrieving a stolen briefcase, discover it holds a secret map to hidden World War II treasures. Betrayed by their own French Minister of Defense and hunted by a former Marine, Vogel, the team faces internal conflicts and danger. As alliances shift, secrets unravel, and battles ensue, they must thwart Vogel's plan to claim the treasures, setting the stage for an international treasure hunt filled with unexpected twists and unresolved romantic entanglements."
1387198,Love in 39 Degrees,2024-12-06,464.613,"Fatih and Kumru, a lawyer from different cities, team up for a case involving a cheating spouse. They spend 8 hours racing around Izmir gathering evidence, unexpectedly altering their plans and lives."
1029235,Azrael,2024-09-27,451.5,"In a world where no one speaks, a devout female hunts down a young woman who has escaped her imprisonment. Recaptured by its ruthless leaders, Azrael is due to be sacrificed to pacify an ancient evil deep within the surrounding wilderness."
98,Gladiator,2000-05-04,444.195,"After the death of Emperor Marcus Aurelius, his devious son takes power and demotes Maximus, one of Rome's most capable generals who Marcus preferred. Eventually, Maximus is forced to become a gladiator and battle to the death against other men for the amusement of paying audiences."
1252470,Sikandar Ka Muqaddar,2024-11-29,435.826,"After an unsolved diamond heist, a hard-nosed cop’s pursuit of his key suspect turns into obsession, until they finally face each other — and the truth."
1171640,GTMAX,2024-11-19,431.216,"When a notorious gang of bikers recruits her brother for a heist, a former motocross champion must face her deepest fears to keep her family safe."
1389038,Mickey and the Very Many Christmases,2024-12-01,411.875,Mickey makes a magical wish that every day could be Christmas — but winds up having second thoughts when his wish actually comes true!
420818,The Lion King,2019-07-12,403.594,"Simba idolizes his father, King Mufasa, and takes to heart his own royal destiny. But not everyone in the kingdom celebrates the new cub's arrival. Scar, Mufasa's brother—and former heir to the throne—has plans of his own. The battle for Pride Rock is ravaged with betrayal, tragedy and drama, ultimately resulting in Simba's exile. With help from a curious pair of newfound friends, Simba will have to figure out how to grow up and take back what is rightfully his."
995803,Arena Wars,2024-06-25,398.462,"In 2045 convicted criminals are given the opportunity to compete on the world's #1 televised sporting event, Arena Wars. They must survive 7 rooms and 7 of the most vicious killers in the country. If they win, they regain their freedom."
1100099,We Live in Time,2024-10-10,384.274,"An up-and-coming chef and a recent divorcée find their lives forever changed when a chance encounter brings them together, in a decade-spanning, deeply moving romance."
573435,Bad Boys: Ride or Die,2024-06-05,383.858,"After their late former Captain is framed, Lowrey and Burnett try to clear his name, only to end up on the run themselves."
791042,Levels,2024-11-01,374.095,"After witnessing his girlfriend's murder, a man risks everything - including reality itself - to discover the truth."
482600,Japanese Mom,2017-02-09,374.047,"""Innocent face, D-cup breasts and perfect intercourse skills! Son, this is not your girlfriend anymore but your mother!""  Ki-ho brings Yuki from Japan to marry her. However, he starts cheating on her with his ex-girlfriend in Korea.  Min-cheol comforted Yuki and thought of her as his daughter-in-law, but one day he realizes he is looking at her as a woman.  In the end, Yuki and Min-cheol have intercourse without Ki-ho knowing..."
360920,The Grinch,2018-11-08,357.72,The Grinch hatches a scheme to ruin Christmas when the residents of Whoville plan their annual holiday celebration.
1061699,The Six Triple Eight,2024-12-06,354.791,"During World War II, the US Army's only all-Black, all-women battalion takes on an impossible mission: sorting through a three-year backlog of 17 million pieces of mail that hadn't been delivered to American soldiers and finish within six months."
1108427,Moana,2026-07-09,354.088,"In Ancient Polynesia, when a terrible curse incurred by Maui reaches the island of an impetuous Chieftain, his willful daughter answers the Ocean's call to seek out the demigod to set things right."
1084736,The Count of Monte Cristo,2024-06-28,350.856,"Edmond Dantes becomes the target of a sinister plot and is arrested on his wedding day for a crime he did not commit. After 14 years in the island prison of Château d’If, he manages a daring escape. Now rich beyond his dreams, he assumes the identity of the Count of Monte-Cristo and exacts his revenge on the three men who betrayed him."
454626,Sonic the Hedgehog,2020-02-12,339.537,"Powered with incredible speed, Sonic The Hedgehog embraces his new home on Earth. That is, until Sonic sparks the attention of super-uncool evil genius Dr. Robotnik. Now it’s super-villain vs. super-sonic in an all-out race across the globe to stop Robotnik from using Sonic’s unique power for world domination."
1087421,Odio el verano,2024-08-23,337.367,
1124641,Classified,2024-09-19,332.134,"Operating alone in the field for more than 20 years, a CIA hitman uses the ""Help Wanted"" section of the newspapers to get his orders from the Agency. His long-lost daughter, now a UK MI6 analyst, tracks him down to deliver shocking news: his CIA boss has been dead for years and the division long since shut down. Together, they set out to discover whose orders he's been executing."
1357633,Solo Leveling -ReAwakening-,2024-11-26,327.505,"Over a decade after 'gates' connecting worlds appeared, awakening 'hunters' with superpowers, weakest hunter Sung Jinwoo encounters a double dungeon and accepts a mysterious quest, becoming the only one able to level up, changing his fate. A catch-up recap of the first season coupled with an exclusive sneak peek of the first two episodes of the highly anticipated second season in one momentous theatrical fan experience."
1154304,Buffalo Kids,2024-08-14,318.968,"Mary and Tom are parentless Irish siblings who arrive in New York City via ocean liner in 1886 and quickly find themselves on a wild, cross-country journey aboard a transcontinental ""Orphan Train"" where they meet an extraordinary new friend who will change their lives forever."
978796,Bagman,2024-09-20,317.516,"For centuries and across cultures, parents have warned their children of the legendary Bagman, who snatches innocent children and stuffs them into his vile, rotting bag—never to be seen again. Patrick McKee narrowly escaped such an encounter as a boy, which left him with lasting scars throughout his adulthood. Now, Patrick’s childhood tormentor has returned, threatening the safety of his wife Karina and son Jake."
823219,Flow,2024-08-29,316.26,"A solitary cat, displaced by a great flood, finds refuge on a boat with various species and must navigate the challenges of adapting to a transformed world together."
1047373,The Silent Hour,2024-10-03,312.068,"While working a case as an interpreter, a hearing-impaired police detective must confront a group of criminals trying to eliminate a deaf murder witness in her apartment building."
1154223,Hunting With Tigers,2024-11-22,311.412,"Malik, a young Parisian hustler, discovers that his stepfather Serge, a famous bank robber, has been arrested along with his accomplices. During the trial, Iris, one of the accused's lawyers, Chérif, requests Malik to accept a dangerous heist in exchange for Serge and her client's liberty. Malik must convince and reunite Chérif's former partners to accomplish this high-risk stickup."
1064028,Subservience,2024-08-15,305.107,"With his wife out sick, a struggling father brings home a lifelike AI, only to have his self-aware new help want everything her new family has to offer... Like the affection of her owner and she'll kill to get it."
259872,Skin. Like. Sun.,2010-02-19,304.87,"Real-life young couple Wim and Floor spend an afternoon in the sunwashed rooms of a crumbling home in Belgium. In a unique twist, this artistic erotic documentary is edited in nearly real-time. In the slowness, we get the build, the sweetness, and the sexiness. Forget about fingersnapping fast editing. Slow is where it’s at."
1125510,The Platform 2,2024-09-27,300.53,"After a mysterious leader imposes his law in a brutal system of vertical cells, a new arrival battles against a dubious food distribution method."
889737,Joker: Folie à Deux,2024-10-01,293.463,"While struggling with his dual identity, Arthur Fleck not only stumbles upon true love, but also finds the music that's always been inside him."
592983,Spellbound,2024-11-22,291.47,"When a powerful spell turns her parents into giant monsters, a teenage princess must journey into the wild to reverse the curse before it's too late."
1371727,Sing: Thriller,2024-10-15,291.401,"Buster Moon dreams up a star-studded spectacle set to Michael Jackson's ""Thriller"" in this animated short featuring characters from the hit ""Sing"" films."
1106739,Juror #2,2024-10-30,287.853,"While serving as a juror in a high profile murder trial, family man Justin Kemp finds himself struggling with a serious moral dilemma…one he could use to sway the jury verdict and potentially convict—or free—the accused killer."
1011985,Kung Fu Panda 4,2024-03-02,284.185,"Po is gearing up to become the spiritual leader of his Valley of Peace, but also needs someone to take his place as Dragon Warrior. As such, he will train a new kung fu practitioner for the spot and will encounter a villain called the Chameleon who conjures villains from the past."
829557,365 Days: This Day,2022-04-26,284.039,"Laura and Massimo are back and hotter than ever. But the reunited couple's new beginning is complicated by Massimo’s family ties and a mysterious man who enters Laura’s life to win her heart and trust, at any cost."
639720,IF,2024-05-08,282.2,"After discovering she can see everyone's imaginary friends, a girl embarks on a magical adventure to reconnect forgotten imaginary friends with their kids."
1116490,Cash Out,2024-04-26,280.421,"Criminal mastermind Mason is about to execute the score of a lifetime when his lover and key member of his crew, Decker, takes the team down and reveals she’s an undercover Interpol agent. Heartbroken, Mason escapes and retires from the life of crime until his younger brother Shawn is out of his league taking on a big bank heist all on his own. Mason has no choice left but to come to the rescue, while Interpol brings Decker in hoping to unnerve him. Before the SWAT teams storm the bank, Mason must use every tool in his arsenal to not only escape with the prize, but also the love of his life."
1326059,Pimpinero: Blood and Oil,2024-10-10,280.09,"When Juan, a young gasoline smuggler, is forced to work for a mysterious organization in the desert bordering Colombia and Venezuela, his girlfriend Diana embarks on a journey to uncover the secrets that inhabit this no-man’s-land."
693134,Dune: Part Two,2024-02-27,279.426,"Follow the mythic journey of Paul Atreides as he unites with Chani and the Fremen while on a path of revenge against the conspirators who destroyed his family. Facing a choice between the love of his life and the fate of the known universe, Paul endeavors to prevent a terrible future only he can foresee."
839033,The Lord of the Rings: The War of the Rohirrim,2024-12-05,275.082,"183 years before the events chronicled in the original trilogy, a sudden attack by Wulf, a clever and ruthless Dunlending lord seeking vengeance for the death of his father, forces Helm Hammerhand and his people to make a daring last stand in the ancient stronghold of the Hornburg. Finding herself in an increasingly desperate situation, Héra, the daughter of Helm, must summon the will to lead the resistance against a deadly enemy intent on their total destruction."
671,Harry Potter and the Philosopher's Stone,2001-11-16,274.759,"Harry Potter has lived under the stairs at his aunt and uncle's house his whole life. But on his 11th birthday, he learns he's a powerful wizard—with a place waiting for him at the Hogwarts School of Witchcraft and Wizardry. As he learns to harness his newfound powers with the help of the school's kindly headmaster, Harry uncovers the truth about his parents' deaths—and about the villain who's to blame."
942890,House of Darkness,2022-09-09,274.051,"Driving home to her secluded estate after meeting at a local bar, a player out to score thinks his beautiful, mysterious date will be another casual hook-up. While getting acquainted, their flirtation turns playful, sexy and sinister. Hoping to get lucky, his luck may have just run out."
1294203,My Fault: London,2025-02-13,272.67,"When Noah's mother, Ella, falls in love with the very wealthy William, the two move from America to London to live with William and his son Nick. Upon arrival, the 18-year-old Noah meets bad boy Nick, and there is an immediate attraction between the two."
