id,title,release_date,popularity,overview
957452,The Crow,2024-08-21,269.322,"Soulmates Eric and Shelly are brutally murdered when the demons of her dark past catch up with them. Given the chance to save his true love by sacrificing himself, Eric sets out to seek merciless revenge on their killers, traversing the worlds of the living and the dead to put the wrong things right."
1155095,The Moor,2024-06-14,267.969,Claire is approached by the father of her murdered childhood friend to help investigate the haunted moor he believes is his son's final resting place.
748783,The Garfield Movie,2024-04-30,264.975,"Garfield, the world-famous, Monday-hating, lasagna-loving indoor cat, is about to have a wild outdoor adventure! After an unexpected reunion with his long-lost father – scruffy street cat Vic – Garfield and his canine friend Odie are forced from their perfectly pampered life into joining Vic in a hilarious, high-stakes heist."
1097870,Dear Santa,2024-11-24,263.849,"Likeable 6th grader Liam writes to Santa asking him to prove that he's real. But Liam is dyslexic and accidentally sends his letter to Satan instead, who shows up at Liam's house, excited to have his first fanboy letter and wanting a little of Liam's soul."
1232449,Young Hearts,2024-10-26,262.405,"Fourteen-year-old Elias increasingly feels like an outsider in his village. When he meets his new neighbour of the same age, Alexander, Elias is confronted with his burgeoning sexuality."
385687,Fast X,2023-05-17,258.741,"Over many missions and against impossible odds, Dom Toretto and his family have outsmarted, out-nerved and outdriven every foe in their path. Now, they confront the most lethal opponent they've ever faced: A terrifying threat emerging from the shadows of the past who's fueled by blood revenge, and who is determined to shatter this family and destroy everything—and everyone—that Dom loves, forever."
157336,Interstellar,2014-11-05,258.255,The adventures of a group of explorers who make use of a newly discovered wormhole to surpass the limitations on human space travel and conquer the vast distances involved in an interstellar voyage.
1331375,Dominique,2024-10-11,258.147,"Dominique, a well-trained assassin, flees from her troubled past in an attempt to begin a new life in South America. However, she soon finds herself in a town plagued with violence and corruption. Facing brutal attacks from the police and mafia, Dominique must decide whether to protect herself or an innocent family that has taken her in."
726139,Project Silence,2024-07-11,256.725,"Due to sudden deteriorating weather conditions, visibility on the Airport Bridge is severely impaired, leaving people stranded and at risk of the bridge collapsing due to a series of chain collisions and explosions. Amidst the chaos, the canine subjects ""Echo"" from the military experiment ""Project Silence,"" who were being transported in secret, break free, and all human survivors become targets of relentless attacks."
653346,Kingdom of the Planet of the Apes,2024-05-08,253.631,"Several generations following Caesar's reign, apes – now the dominant species – live harmoniously while humans have been reduced to living in the shadows. As a new tyrannical ape leader builds his empire, one young ape undertakes a harrowing journey that will cause him to question all he's known about the past and to make choices that will define a future for apes and humans alike."
1082195,The Order,2024-12-05,247.657,A string of violent robberies in the Pacific Northwest leads a veteran FBI agent into a domestic terrorist plot to overthrow the federal government.
917496,Beetlejuice Beetlejuice,2024-09-04,247.485,"After a family tragedy, three generations of the Deetz family return home to Winter River. Still haunted by Betelgeuse, Lydia's life is turned upside down when her teenage daughter, Astrid, accidentally opens the portal to the Afterlife."
857598,Pushpa 2 - The Rule,2024-12-04,246.031,"Pushpa struggles to sustain his sandalwood smuggling business in the face of tough opposition from the police, led by arch-rival Bhanwar Singh Shekhawat ."
1100856,Whisper of the Witch,2024-06-13,245.751,"Mara, an ancient pagan spirit, hunts a group of teenagers taking their body parts to be reborn. A disillusioned and desperate investigator has to face his deepest fears to save the teenagers."
7451,xXx,2002-08-09,244.24,"Xander Cage is your standard adrenaline junkie with no fear and a lousy attitude. When the US Government ""recruits"" him to go on a mission, he's not exactly thrilled. His mission: to gather information on an organization that may just be planning the destruction of the world, led by the nihilistic Yorgi."
411,"The Chronicles of Narnia: The Lion, the Witch and the Wardrobe",2005-12-07,231.377,"Siblings Lucy, Edmund, Susan and Peter step through a magical wardrobe and find the land of Narnia. There, they discover a charming, once peaceful kingdom that has been plunged into eternal winter by the evil White Witch, Jadis. Aided by the wise and magnificent lion, Aslan, the children lead Narnia into a spectacular, climactic battle to be free of the Witch's glacial powers forever."
592695,Pleasure,2021-10-08,236.749,"19 year old Linnéa leaves her small town in Sweden and heads for Los Angeles with the aim of becoming the world's next big porn star, but the road to her goal turns out to be bumpier than she imagined."
335983,Venom,2018-09-28,214.546,"Investigative journalist Eddie Brock attempts a comeback following a scandal, but accidentally becomes the host of Venom, a violent, super powerful alien symbiote. Soon, he must rely on his newfound powers to protect the world from a shadowy organization looking for a symbiote of their own."
1014505,OVERLORD: The Sacred Kingdom,2024-09-20,234.644,"After twelve years of playing his favorite MMORPG game, Momonga logs in for the last time only to find himself transported into its world playing it indefinitely. Throughout his adventures, his avatar ascends to the title of Sorcerer King Ains Ooal Gown. Once prosperous but now on the brink of ruin, The Sacred Kingdom enjoyed years of peace after construction of an enormous wall protecting them from neighboring invasions. But, one day this comes to an end when the Demon Emperor Jaldabaoth arrives with an army of villainous demi-humans. Fearing invasion of their own lands, the neighboring territory of the Slane Theocracy is forced to beg their enemies at the Sorcerer Kingdom for help. Heeding the call, Momonga, now known as the Sorcerer King Ains Ooal Gown, rallies the Sorcerer Kingdom and its undead army to join the fight alongside the Sacred Kingdom and the Slane Theocracy in hopes to defeat the Demon Emperor."
1354627,SpongeBob Squarepants: Kreepaway Kamp,2024-10-10,238.191,"While at Kamp Koral for a reunion, SpongeBob and the gang are stalked by a mysterious figure lurking in the shadows as campers start disappearing one by one!"
1190586,Leggings Mania,2023-07-13,246.031,"Jeong-hee was living with a man due to a de facto marriage. One day, her daughter, Dam-hoi, returned from her study abroad. Dam-hoi always wears leggings. The soon-to-be stepdad, Byeong-min, who is usually a fan of leggings, pays attention to her daughter's clothes. Jeong-hee noticed it, so she also started wearing leggings to distract her young prospective husband."
1016848,The Front Room,2024-09-05,307.1,"Everything goes to hell for newly-pregnant Belinda after her mother-in-law moves in. As the diabolical guest tries to get her claws on the child, Belinda must draw the line somewhere."
762441,A Quiet Place: Day One,2024-06-26,229.677,"As New York City is invaded by alien creatures who hunt by sound, a woman named Sam fights to survive with her cat."
974576,Conclave,2024-10-25,235.013,"After the unexpected death of the Pope, Cardinal Lawrence is tasked with managing the covert and ancient ritual of electing a new one. Sequestered in the Vatican with the Catholic Church’s most powerful leaders until the process is complete, Lawrence finds himself at the center of a conspiracy that could lead to its downfall."
1084863,The Soul Eater,2024-04-24,220.907,"When the disappearance of children and bloody murders multiply in a small mountain village, an old legend shrouded in sulphur reappears... Commander Guardiano and Captain of the Gendarmerie De Rolan are forced to join forces to uncover the truth."
569094,Spider-Man: Across the Spider-Verse,2023-05-31,221.902,"After reuniting with Gwen Stacy, Brooklyn’s full-time, friendly neighborhood Spider-Man is catapulted across the Multiverse, where he encounters the Spider Society, a team of Spider-People charged with protecting the Multiverse’s very existence. But when the heroes clash on how to handle a new threat, Miles finds himself pitted against the other Spiders and must set out on his own to save those he loves most."
507241,The Killer's Game,2024-09-12,224.977,"When top hitman Joe Flood is diagnosed with a terminal illness, he decides to take matters into his own hands – by taking a hit out on himself. But when the very hitmen he hired also target his ex-girlfriend, he must fend off an army of assassin colleagues and win back the love of his life before it's too late."
823464,Godzilla x Kong: The New Empire,2024-03-27,237.843,"Following their explosive showdown, Godzilla and Kong must reunite against a colossal undiscovered threat hidden within our world, challenging their very existence – and our own."
1215162,Kill 'em All 2,2024-09-24,250.35,"Phillip and Suzanne are retired from the spy game, living peacefully off the grid. That's until their whereabouts are discovered by Vlad, the vengeful brother of their target from the first film."
786892,Furiosa: A Mad Max Saga,2024-05-22,212.446,"As the world falls, young Furiosa is snatched from the Green Place of Many Mothers into the hands of a great biker horde led by the warlord Dementus. Sweeping through the wasteland, they encounter the citadel presided over by Immortan Joe. The two tyrants wage war for dominance, and Furiosa must survive many trials as she puts together the means to find her way home."
1144962,Transmorphers: Mech Beasts,2023-06-09,218.845,"20 years after the events of Transmorphers, a newer, more advanced species of alien robot descends on a rebuilt Earth, threatening once again to destroy the planet."
1094974,Take Cover,2024-10-04,215.702,A burned-out professional sniper finds himself trapped in an all-glass penthouse by a lethal competitor and must find a way to survive and escape with little to no cover between him and the killer.
8587,The Lion King,1994-06-24,212.534,"Young lion prince Simba flees when his father is killed by his usurper uncle. Years after the betrayal and tragedy, a grown-up and mature Simba returns to claim his rightful place on the throne."
1230477,Given The Movie : Hiiragi Mix,2024-01-27,194.293,Hiiragi Mix takes place after the events of Given and is focuses on the relationship between Mafuyu's childhood friends Hiiragi Kashima and Shizusumi Yagi.
667538,Transformers: Rise of the Beasts,2023-06-06,200.453,"When a new threat capable of destroying the entire planet emerges, Optimus Prime and the Autobots must team up with a powerful faction known as the Maximals. With the fate of humanity hanging in the balance, humans Noah and Elena will do whatever it takes to help the Transformers as they engage in the ultimate battle to save Earth."
1159311,My Hero Academia: You're Next,2024-08-02,217.349,"In a society devastated by the effects of an all-out war between heroes and villains, a mysterious giant fortress suddenly appears, engulfing towns and people one after another. Then, a man reminiscent of All Might, the 'symbol of peace', stands in front of Izuku and his friends..."
646097,Rebel Ridge,2024-08-27,216.041,A former Marine confronts corruption in a small town when local law enforcement unjustly seizes the bag of cash he needs to post his cousin's bail.
426889,Le clitoris,2016-06-18,215.338,"Women are lucky, they get to have the only organ in the human body dedicated exclusively for pleasure: the clitoris! In this humorous and instructive animated documentary, find out its unrecognized anatomy and its unknown herstory."
673,Harry Potter and the Prisoner of Azkaban,2004-05-31,214.466,"Year three at Hogwarts means new fun and challenges as Harry learns the delicate art of approaching a Hippogriff, transforming shape-shifting Boggarts into hilarity and even turning back time. But the term also brings danger: soul-sucking Dementors hover over the school, an ally of the accursed He-Who-Cannot-Be-Named lurks within the castle walls, and fearsome wizard Sirius Black escapes Azkaban. And Harry will confront them all."
672,Harry Potter and the Chamber of Secrets,2002-11-13,213.809,"Cars fly, trees fight back, and a mysterious house-elf comes to warn Harry Potter at the start of his second year at Hogwarts. Adventure and danger await when bloody writing on a wall announces: The Chamber Of Secrets Has Been Opened. To save Hogwarts will require all of Harry, Ron and Hermione’s magical abilities and courage."
438631,Dune,2021-09-15,204.722,"Paul Atreides, a brilliant and gifted young man born into a great destiny beyond his understanding, must travel to the most dangerous planet in the universe to ensure the future of his family and his people. As malevolent forces explode into conflict over the planet's exclusive supply of the most precious resource in existence-a commodity capable of unlocking humanity's greatest potential-only those who can conquer their fear will survive."
1329336,The Bad Guys: Haunted Heist,2024-10-02,204.522,The crafty Bad Guys crew embarks on a high-stakes Halloween heist to swipe a priceless amulet from a spooky mansion. What could go wrong?
976734,Canary Black,2024-10-10,204.119,"Top level CIA agent Avery Graves is blackmailed by terrorists into betraying her own country to save her kidnapped husband. Cut off from her team, she turns to her underworld contacts to survive and help locate the coveted intelligence that the kidnappers want."
1097549,Babygirl,2024-12-25,202.786,A high-powered CEO puts her career and family on the line when she begins a torrid affair with her much younger intern.
1165466,Wake Up,2024-05-08,202.332,"A group of young activists set out to make an environmental statement by vandalizing a home superstore as it closes. But their plan goes terribly wrong when they become trapped inside and must face a deranged security guard with a gruesome passion for primitive hunting. As the night fills with violence and terror, the teenagers find themselves in a desperate fight for their lives."
1387866,Disaster Holiday,2024-12-12,201.014,"A workaholic dad, trying to win over his kids, heads to the coast of Durban for a big work meeting — under the guise of a family road trip vacation."
1355755,An Almost Christmas Story,2024-10-14,200.637,"A young owl meets a lost little girl in New York City. Together, they try to get home for Christmas."
929590,Civil War,2024-04-10,199.467,"In the near future, a group of war journalists attempt to survive while reporting the truth as the United States stands on the brink of civil war."
674,Harry Potter and the Goblet of Fire,2005-11-16,199.332,"When Harry Potter's name emerges from the Goblet of Fire, he becomes a competitor in a grueling battle for glory among three wizarding schools—the Triwizard Tournament. But since Harry never submitted his name for the Tournament, who did? Now Harry must confront a deadly dragon, fierce water demons and an enchanted maze only to find himself in the cruel grasp of He Who Must Not Be Named."
1104844,BLUE LOCK THE MOVIE -EPISODE NAGI-,2024-04-19,198.887,"""That's a hassle."" That was second-year high schooler Nagi Seishirou's favorite phrase as he lived his dull life. Until Mikage Reo, a classmate who dreamed of winning the World Cup, discovered Nagi's hidden skill, inspiring him to play soccer and share his outstanding talent. One day, Nagi Seishiro receives an invitation to the mysterious Blue Lock Project. What awaits him there is an encounter with the finest strikers assembled from across the country. Nagi's dream of becoming the best, alongside Mikage Reo, will take this prodigy to a world he's never known."
1395642,Umjolo: Day Ones,2024-12-20,198.838,"Zanele and Andile have been best friends since day one. But now that Andile is married with kids, is Zanele destined to be in the friend zone forever?"
718821,Twisters,2024-07-10,197.458,"As storm season intensifies, the paths of former storm chaser Kate Carter and reckless social-media superstar Tyler Owens collide when terrifying phenomena never seen before are unleashed. The pair and their competing teams find themselves squarely in the paths of multiple storm systems converging over central Oklahoma in the fight of their lives."
940551,Migration,2023-12-06,197.362,"After a migrating duck family alights on their pond with thrilling tales of far-flung places, the Mallard family embarks on a family road trip, from New England, to New York City, to tropical Jamaica."
972614,Knox Goes Away,2024-03-15,195.007,"A contract killer, after being diagnosed with a fast-moving form of dementia, is presented with the opportunity to redeem himself by saving the life of his estranged adult son. But to do so, he must race against the police closing in on him as well as the ticking clock of his own rapidly deteriorating mind."
12445,Harry Potter and the Deathly Hallows: Part 2,2011-07-12,193.07,"Harry, Ron and Hermione continue their quest to vanquish the evil Voldemort once and for all. Just as things begin to look hopeless for the young wizards, Harry discovers a trio of magical objects that endow him with powers to rival Voldemort's formidable skills."
1147710,Hijack 1971,2024-06-21,205.691,"Pilots Tae-in and Gyu-sik are set to fly to Gimpo. Under the guidance of flight attendant Ok-soon, passengers are busy boarding. However, shortly after takeoff, a homemade bomb explodes, turning the cabin into chaos."
1287717,Do Not Enter,2024-08-06,198.687,"Two working class youtubers ‘in the making’ enter an abandoned mansion to get their basketball back, and get lost inside while pranking each other. They record their ‘quick adventure’ with their phones for their audience, and tweak it with a fake phantom appearance to attract more followers to their YouTube channel. When uploaded the video goes viral, so they start a challenge: if the video reaches a certain number of views, they will enter the house again, at night, alone, totally unprotected. As fans react positively, they will do as promised, not only to discover and unveil the true nature of the place and their inhabitants, but to realize they might not be among the living anymore. Which opens a question - how far would you go to be famous?"
580489,Venom: Let There Be Carnage,2021-09-30,194.546,"After finding a host body in investigative reporter Eddie Brock, the alien symbiote must face a new enemy, Carnage, the alter ego of serial killer Cletus Kasady."
1079091,It Ends with Us,2024-08-07,188.214,"When a woman's first love suddenly reenters her life, her relationship with a charming, but abusive neurosurgeon is upended, and she realizes she must learn to rely on her own strength to make an impossible choice for her future."
1243381,Mary,2024-12-12,188.799,A miraculous conception. A merciless king. A murderous pursuit. Mary's journey to give birth to Jesus unfolds in this biblical coming-of-age epic.
287903,Krampus,2015-11-26,147.735,"When his dysfunctional family clashes over the holidays, young Max is disillusioned and turns his back on Christmas.  Little does he know, this lack of festive spirit has unleashed the wrath of Krampus: a demonic force of ancient evil intent on punishing non-believers."
216015,Fifty Shades of Grey,2015-02-11,186.458,"When college senior Anastasia Steele steps in for her sick roommate to interview prominent businessman Christian Grey for their campus paper, little does she realize the path her life will take. Christian, as enigmatic as he is rich and powerful, finds himself strangely drawn to Ana, and she to him. Though sexually inexperienced, Ana plunges headlong into an affair -- and learns that Christian's true sexual proclivities push the boundaries of pain and pleasure."
634649,Spider-Man: No Way Home,2021-12-15,199.379,"Peter Parker is unmasked and no longer able to separate his normal life from the high-stakes of being a super-hero. When he asks for help from Doctor Strange the stakes become even more dangerous, forcing him to discover what it truly means to be Spider-Man."
1129598,Prey,2024-03-15,193.539,A young couple is compelled to leave their Christian missionary station in the Kalahari Desert after being threatened with death by an extremist militant gang. After crashing their aircraft they must battle man and beast for their lives.
588555,My Grandfather's Demons,2022-09-21,178.411,"Rosa's life, a highly valued professional, is turned upside down when her grandfather Marcelino dies."
238,The Godfather,1972-03-14,206.818,"Spanning the years 1945 to 1955, a chronicle of the fictional Italian-American Corleone crime family. When organized crime family patriarch, Vito Corleone barely survives an attempt on his life, his youngest son, Michael steps in to take care of the would-be killers, launching a campaign of bloody revenge."
1145028,Woman in the Maze,2023-10-06,185.809,"A young woman rents a cursed house, forcing her to solve the mystery to find a way out."
866398,The Beekeeper,2024-01-08,181.652,One man's campaign for vengeance takes on national stakes after he is revealed to be a former operative of a powerful and clandestine organization known as Beekeepers.
1149913,TOGEFILM - Mei Mei,2023-04-06,183.01,
603692,John Wick: Chapter 4,2023-03-22,188.837,"With the price on his head ever increasing, John Wick uncovers a path to defeating The High Table. But before he can earn his freedom, Wick must face off against a new enemy with powerful alliances across the globe and forces that turn old friends into foes."
829560,The Next 365 Days,2022-08-18,193.923,Laura and Massimo's relationship hangs in the balance as they try to overcome trust issues while a tenacious Nacho works to push them apart.
41446,Scream 4,2011-04-13,114.357,"Ten years have passed, and Sidney Prescott has put herself back together thanks to her writing. However, her return to Woodsboro sparks the return of the Ghostface Killer."
597,Titanic,1997-11-18,165.501,"101-year-old Rose DeWitt Bukater tells the story of her life aboard the Titanic, 84 years later. A young Rose boards the ship with her mother and fiancé. Meanwhile, Jack Dawson and Fabrizio De Rossi win third-class tickets aboard the ship. Rose tells the whole story from Titanic's departure through to its death—on its first and last voyage—on April 15, 1912."
1063877,Don't Move,2024-10-24,177.631,"A grieving woman in a secluded forest encounters a killer who injects her with a paralytic drug. As her body shuts down, her fight for survival begins."
818647,Through My Window,2022-02-04,200.874,"Raquel's longtime crush on her next-door neighbor turns into something more when he starts developing feelings for her, despite his family's objections."
1142518,Freedom,2024-11-01,171.265,"Inspired by the true events of one of France's most notorious non-violent robbers, Bruno Sulak, in the 1980s. He led multiple heists, then captured public attention for his many daring escapes from police custody...always to reunite with his beloved lover and accomplice Annie, becoming both France's Public Enemy #1 and an icon of Freedom."
365177,Borderlands,2024-08-07,176.382,"Returning to her home planet, an infamous bounty hunter forms an unexpected alliance with a team of unlikely heroes. Together, they battle monsters and dangerous bandits to protect a young girl who holds the key to unimaginable power."
1216191,Oddity,2024-07-19,175.636,"After the brutal murder of her twin sister, Darcy goes after those responsible by using haunted items as her tools for revenge."
46848,Private Collections,1979-06-27,160.482,"Three stories. A solitary sailor falls from his boat and washes ashore on a tropical island. While seeking rescue, he's found by a nearly naked woman who is playful and compliant. He decides to erase his signs of distress and remain on the island. What awaits?  In the second, an adolescent searches for the words of a nursery rime he remembers bits of. His journey takes him into dreams, sexual awakening, and Oedipal fantasy.  Third, a man of wealth in late-nineteenth century Paris hires a prostitute for the night. She's also cabaret performer and takes him to her room. He fears he's about to be robbed. What's her secret?"
278,The Shawshank Redemption,1994-09-23,160.564,"Imprisoned in the 1940s for the double murder of his wife and her lover, upstanding banker Andy Dufresne begins a new life at the Shawshank prison, where he puts his accounting skills to work for an amoral warden. During his long stretch in prison, Dufresne comes to be admired by the other inmates -- including an older prisoner named Red -- for his integrity and unquenchable sense of hope."
1029281,Strange Darling,2024-08-22,175.077,Nothing is what it seems when a twisted one-night stand spirals into a serial killer’s vicious murder spree.
1041317,Battle for the Western Front,2022-10-06,173.44,"Inspired by Canuck WWI flying ace Billy Bishop, two young soldiers crash the front lines in August 1918. With the Allies detained, their platoon must desperately hold out alongside legendary Anishinaabe sniper Francis ""Peggy"" Pegahmagabow."
370663,Below Her Mouth,2017-02-10,173.305,An unexpected affair quickly escalates into a heart-stopping reality for two women whose passionate connection changes their lives forever.
